===== Q01 =====
-- Q01 [basic] Find active policies with high annual premiums.

-- Q01 [basic] Find active policies with high annual premiums.
SELECT policy_number, annual_premium, status
FROM policies
WHERE status = 'active' AND annual_premium >= 600000
ORDER BY annual_premium DESC
LIMIT 5;
 policy_number | annual_premium | status 
---------------+----------------+--------
 POL-2024-0005 |     1260000.00 | active
 POL-2024-0004 |      845000.00 | active
 POL-2024-0010 |      640000.00 | active
(3 rows)


===== Q02 =====
-- Q02 [basic] List high-risk customers by score.

-- Q02 [basic] List high-risk customers by score.
SELECT customer_code, full_name, region, occupation, risk_score
FROM customers
WHERE risk_score >= 50
ORDER BY risk_score DESC, full_name
LIMIT 10;
 customer_code |  full_name   | region  |   occupation    | risk_score 
---------------+--------------+---------+-----------------+------------
 CUS-0007      | Yoon Jisoo   | Ulsan   | factory manager |         71
 CUS-0005      | Jung Hyunwoo | Gwangju | self-employed   |         63
 CUS-0008      | Han Doyun    | Jeju    | pilot           |         58
 CUS-0010      | Oh Taemin    | Suwon   | sales manager   |         52
(4 rows)


===== Q03 =====
-- Q03 [basic] Find claims paid after June 2024.

-- Q03 [basic] Find claims paid after June 2024.
SELECT claim_number, claim_date, claim_type, paid_amount, claim_status
FROM claims
WHERE claim_date >= DATE '2024-06-01' AND paid_amount > 0
ORDER BY claim_date, paid_amount DESC
LIMIT 10;
 claim_number  | claim_date |    claim_type    | paid_amount | claim_status 
---------------+------------+------------------+-------------+--------------
 CLM-2024-0006 | 2024-06-15 | lost baggage     |   650000.00 | paid
 CLM-2024-0008 | 2024-07-19 | fire damage      |  7800000.00 | paid
 CLM-2024-0009 | 2024-08-02 | cancer diagnosis |  6000000.00 | paid
(3 rows)


===== Q04 =====
-- Q04 [basic] Review products with base annual premium below 400,000 KRW.

-- Q04 [basic] Review products with base annual premium below 400,000 KRW.
SELECT product_code, product_name, line_of_business, base_annual_premium
FROM insurance_products
WHERE base_annual_premium < 400000
ORDER BY base_annual_premium ASC
LIMIT 10;
  product_code  |     product_name      | line_of_business | base_annual_premium 
----------------+-----------------------+------------------+---------------------
 TRAVEL-ANNUAL  | Annual Travel Protect | travel           |           180000.00
 HOME-FIRE-01   | Home Fire Guard       | property         |           250000.00
 CANCER-CARE-01 | Cancer Care Rider     | health           |           310000.00
 AUTO-BASIC-01  | Auto Basic Cover      | auto             |           390000.00
(4 rows)


===== Q05 =====
-- Q05 [join: inner] Join policies to customers and products for underwriting review.

-- Q05 [join: inner] Join policies to customers and products for underwriting review.
SELECT p.policy_number, c.full_name, pr.product_name, p.insured_amount, p.annual_premium
FROM policies p
INNER JOIN customers c ON c.customer_id = p.customer_id
INNER JOIN insurance_products pr ON pr.product_id = p.product_id
ORDER BY p.policy_number;
 policy_number |  full_name   |        product_name        | insured_amount | annual_premium 
---------------+--------------+----------------------------+----------------+----------------
 POL-2024-0001 | Kim Minjun   | Term Life Secure 10        |   100000000.00 |      438000.00
 POL-2024-0002 | Lee Seoyeon  | Health Standard Care       |    30000000.00 |      545000.00
 POL-2024-0003 | Park Jiho    | Auto Basic Cover           |    20000000.00 |      412000.00
 POL-2024-0004 | Choi Hana    | Health Premium Care        |    50000000.00 |      845000.00
 POL-2024-0005 | Jung Hyunwoo | Retirement Pension Builder |   150000000.00 |     1260000.00
 POL-2024-0006 | Kang Yuna    | Annual Travel Protect      |    10000000.00 |      185000.00
 POL-2024-0007 | Yoon Jisoo   | Auto Plus Cover            |    30000000.00 |      655000.00
 POL-2024-0008 | Han Doyun    | Home Fire Guard            |    80000000.00 |      275000.00
 POL-2024-0009 | Seo Ara      | Cancer Care Rider          |    40000000.00 |      320000.00
 POL-2024-0010 | Oh Taemin    | Term Life Secure 20        |   120000000.00 |      640000.00
(10 rows)


===== Q06 =====
-- Q06 [join: inner] Show paid claims with customer and product context.

-- Q06 [join: inner] Show paid claims with customer and product context.
SELECT cl.claim_number, c.full_name, pr.line_of_business, cl.claim_type, cl.paid_amount
FROM claims cl
INNER JOIN policies p ON p.policy_id = cl.policy_id
INNER JOIN customers c ON c.customer_id = p.customer_id
INNER JOIN insurance_products pr ON pr.product_id = p.product_id
WHERE cl.claim_status = 'paid'
ORDER BY cl.paid_amount DESC;
 claim_number  |  full_name  | line_of_business |      claim_type      | paid_amount 
---------------+-------------+------------------+----------------------+-------------
 CLM-2024-0008 | Han Doyun   | property         | fire damage          |  7800000.00
 CLM-2024-0009 | Seo Ara     | health           | cancer diagnosis     |  6000000.00
 CLM-2024-0003 | Park Jiho   | auto             | vehicle collision    |  1800000.00
 CLM-2024-0006 | Kang Yuna   | travel           | lost baggage         |   650000.00
 CLM-2024-0002 | Lee Seoyeon | health           | outpatient treatment |   360000.00
(5 rows)


===== Q07 =====
-- Q07 [join: left] Show every customer and any policy they hold.

-- Q07 [join: left] Show every customer and any policy they hold.
SELECT c.customer_code, c.full_name, p.policy_number, p.status
FROM customers c
LEFT JOIN policies p ON p.customer_id = c.customer_id
ORDER BY c.customer_code, p.policy_number;
 customer_code |  full_name   | policy_number | status 
---------------+--------------+---------------+--------
 CUS-0001      | Kim Minjun   | POL-2024-0001 | active
 CUS-0002      | Lee Seoyeon  | POL-2024-0002 | active
 CUS-0003      | Park Jiho    | POL-2024-0003 | active
 CUS-0004      | Choi Hana    | POL-2024-0004 | active
 CUS-0005      | Jung Hyunwoo | POL-2024-0005 | active
 CUS-0006      | Kang Yuna    | POL-2024-0006 | active
 CUS-0007      | Yoon Jisoo   | POL-2024-0007 | lapsed
 CUS-0008      | Han Doyun    | POL-2024-0008 | active
 CUS-0009      | Seo Ara      | POL-2024-0009 | active
 CUS-0010      | Oh Taemin    | POL-2024-0010 | active
(10 rows)


===== Q08 =====
-- Q08 [join: inner] Connect premium payment status to policy and customer.

-- Q08 [join: inner] Connect premium payment status to policy and customer.
SELECT p.policy_number, c.full_name, pp.payment_date, pp.paid_amount, pp.payment_status
FROM premium_payments pp
INNER JOIN policies p ON p.policy_id = pp.policy_id
INNER JOIN customers c ON c.customer_id = p.customer_id
ORDER BY pp.payment_date;
 policy_number |  full_name   | payment_date | paid_amount | payment_status 
---------------+--------------+--------------+-------------+----------------
 POL-2024-0001 | Kim Minjun   | 2024-01-01   |   438000.00 | paid
 POL-2024-0002 | Lee Seoyeon  | 2024-01-15   |   545000.00 | paid
 POL-2024-0003 | Park Jiho    | 2024-02-01   |   412000.00 | paid
 POL-2024-0004 | Choi Hana    | 2024-02-10   |   845000.00 | paid
 POL-2024-0005 | Jung Hyunwoo | 2024-03-01   |  1260000.00 | paid
 POL-2024-0006 | Kang Yuna    | 2024-03-15   |   185000.00 | paid
 POL-2024-0007 | Yoon Jisoo   | 2024-04-01   |   327500.00 | late
 POL-2024-0008 | Han Doyun    | 2024-04-20   |   275000.00 | paid
 POL-2024-0009 | Seo Ara      | 2024-05-01   |   320000.00 | paid
 POL-2024-0010 | Oh Taemin    | 2024-05-15   |   640000.00 | paid
(10 rows)


===== Q09 =====
-- Q09 [join: inner] Rank claim amounts by insurance line.

-- Q09 [join: inner] Rank claim amounts by insurance line.
SELECT pr.line_of_business, cl.claim_number, cl.claim_amount, cl.paid_amount
FROM claims cl
INNER JOIN policies p ON p.policy_id = cl.policy_id
INNER JOIN insurance_products pr ON pr.product_id = p.product_id
ORDER BY pr.line_of_business, cl.claim_amount DESC;
 line_of_business | claim_number  | claim_amount | paid_amount 
------------------+---------------+--------------+-------------
 auto             | CLM-2024-0007 |   4800000.00 |        0.00
 auto             | CLM-2024-0003 |   2100000.00 |  1800000.00
 health           | CLM-2024-0009 |   6000000.00 |  6000000.00
 health           | CLM-2024-0004 |   3500000.00 |  3000000.00
 health           | CLM-2024-0002 |    450000.00 |   360000.00
 life             | CLM-2024-0001 |   5000000.00 |        0.00
 life             | CLM-2024-0010 |   2300000.00 |        0.00
 pension          | CLM-2024-0005 |   1200000.00 |        0.00
 property         | CLM-2024-0008 |   9500000.00 |  7800000.00
 travel           | CLM-2024-0006 |    700000.00 |   650000.00
(10 rows)


===== Q10 =====
-- Q10 [aggregate] Count policies and sum annual premium by line of business.

-- Q10 [aggregate] Count policies and sum annual premium by line of business.
SELECT pr.line_of_business,
       COUNT(*) AS policy_count,
       SUM(p.annual_premium) AS total_annual_premium
FROM policies p
INNER JOIN insurance_products pr ON pr.product_id = p.product_id
GROUP BY pr.line_of_business
ORDER BY total_annual_premium DESC;
 line_of_business | policy_count | total_annual_premium 
------------------+--------------+----------------------
 health           |            3 |           1710000.00
 pension          |            1 |           1260000.00
 life             |            2 |           1078000.00
 auto             |            2 |           1067000.00
 property         |            1 |            275000.00
 travel           |            1 |            185000.00
(6 rows)


===== Q11 =====
-- Q11 [aggregate] Calculate average customer risk score by region.

-- Q11 [aggregate] Calculate average customer risk score by region.
SELECT region,
       COUNT(*) AS customer_count,
       AVG(risk_score) AS average_risk_score
FROM customers
GROUP BY region
ORDER BY average_risk_score DESC;
 region  | customer_count | average_risk_score  
---------+----------------+---------------------
 Ulsan   |              1 | 71.0000000000000000
 Gwangju |              1 | 63.0000000000000000
 Jeju    |              1 | 58.0000000000000000
 Suwon   |              1 | 52.0000000000000000
 Daegu   |              1 | 47.0000000000000000
 Incheon |              1 | 39.0000000000000000
 Busan   |              1 | 28.0000000000000000
 Seoul   |              2 | 28.0000000000000000
 Daejeon |              1 | 25.0000000000000000
(9 rows)


===== Q12 =====
-- Q12 [aggregate] Calculate loss ratio by insurance line.

-- Q12 [aggregate] Calculate loss ratio by insurance line.
SELECT pr.line_of_business,
       SUM(cl.paid_amount) AS total_paid_claims,
       SUM(p.annual_premium) AS total_annual_premium,
       ROUND(SUM(cl.paid_amount) / NULLIF(SUM(p.annual_premium), 0), 4) AS loss_ratio
FROM claims cl
INNER JOIN policies p ON p.policy_id = cl.policy_id
INNER JOIN insurance_products pr ON pr.product_id = p.product_id
GROUP BY pr.line_of_business
ORDER BY loss_ratio DESC;
 line_of_business | total_paid_claims | total_annual_premium | loss_ratio 
------------------+-------------------+----------------------+------------
 property         |        7800000.00 |            275000.00 |    28.3636
 health           |        9360000.00 |           1710000.00 |     5.4737
 travel           |         650000.00 |            185000.00 |     3.5135
 auto             |        1800000.00 |           1067000.00 |     1.6870
 life             |              0.00 |           1078000.00 |     0.0000
 pension          |              0.00 |           1260000.00 |     0.0000
(6 rows)


===== Q13 =====
-- Q13 [aggregate] Count payment statuses and total paid premium.

-- Q13 [aggregate] Count payment statuses and total paid premium.
SELECT payment_status,
       COUNT(*) AS payment_count,
       SUM(paid_amount) AS total_paid_amount
FROM premium_payments
GROUP BY payment_status
ORDER BY payment_count DESC, total_paid_amount DESC;
 payment_status | payment_count | total_paid_amount 
----------------+---------------+-------------------
 paid           |             9 |        4920000.00
 late           |             1 |         327500.00
(2 rows)


===== Q14 =====
-- Q14 [subquery] Find policies whose annual premium is above the portfolio average.

-- Q14 [subquery] Find policies whose annual premium is above the portfolio average.
SELECT policy_number, annual_premium
FROM policies
WHERE annual_premium > (SELECT AVG(annual_premium) FROM policies)
ORDER BY annual_premium DESC;
 policy_number | annual_premium 
---------------+----------------
 POL-2024-0005 |     1260000.00
 POL-2024-0004 |      845000.00
 POL-2024-0007 |      655000.00
 POL-2024-0010 |      640000.00
(4 rows)


===== Q15 =====
-- Q15 [bonus: join-vs-subquery, join version] Find customers with paid claim amounts above 3,000,000 KRW.

-- Q15 [bonus: join-vs-subquery, join version] Find customers with paid claim amounts above 3,000,000 KRW.
SELECT DISTINCT c.customer_code, c.full_name, cl.paid_amount
FROM customers c
INNER JOIN policies p ON p.customer_id = c.customer_id
INNER JOIN claims cl ON cl.policy_id = p.policy_id
WHERE cl.paid_amount > 3000000
ORDER BY cl.paid_amount DESC;
 customer_code | full_name | paid_amount 
---------------+-----------+-------------
 CUS-0008      | Han Doyun |  7800000.00
 CUS-0009      | Seo Ara   |  6000000.00
(2 rows)


===== Q16 =====
-- Q16 [bonus: join-vs-subquery, subquery version] Same requirement as Q15 using a subquery.

-- Q16 [bonus: join-vs-subquery, subquery version] Same requirement as Q15 using a subquery.
SELECT c.customer_code, c.full_name
FROM customers c
WHERE c.customer_id IN (
    SELECT p.customer_id
    FROM policies p
    WHERE p.policy_id IN (
        SELECT cl.policy_id
        FROM claims cl
        WHERE cl.paid_amount > 3000000
    )
)
ORDER BY c.customer_code;
 customer_code | full_name 
---------------+-----------
 CUS-0008      | Han Doyun
 CUS-0009      | Seo Ara
(2 rows)


===== Q17 =====
-- Q17 [update] Test a status update without permanently changing sample data.

-- Q17 [update] Test a status update without permanently changing sample data.
BEGIN;
BEGIN
UPDATE policies
SET status = 'lapsed'
WHERE policy_number = 'POL-2024-0003'
RETURNING policy_number, status;
 policy_number | status 
---------------+--------
 POL-2024-0003 | lapsed
(1 row)

UPDATE 1
ROLLBACK;
ROLLBACK

===== Q18 =====
-- Q18 [delete] Test claim deletion without permanently changing sample data.

-- Q18 [delete] Test claim deletion without permanently changing sample data.
BEGIN;
BEGIN
DELETE FROM claims
WHERE claim_number = 'CLM-2024-0001'
RETURNING claim_number, claim_status;
 claim_number  | claim_status 
---------------+--------------
 CLM-2024-0001 | open
(1 row)

DELETE 1
ROLLBACK;
ROLLBACK

===== Q19 =====
-- Q19 [index] PostgreSQL B-tree index for frequent actuarial loss-ratio grouping by claim date.

-- Q19 [index] PostgreSQL B-tree index for frequent actuarial loss-ratio grouping by claim date.
-- PostgreSQL-specific syntax: CREATE INDEX IF NOT EXISTS avoids an error when rerunning the script.
CREATE INDEX IF NOT EXISTS idx_claims_claim_date ON claims (claim_date);
CREATE INDEX

===== Q20 =====
-- Q20 [metric] Monthly paid claim trend for actuarial monitoring.

-- Q20 [metric] Monthly paid claim trend for actuarial monitoring.
-- PostgreSQL-specific syntax: DATE_TRUNC groups dates by month.
SELECT DATE_TRUNC('month', claim_date)::date AS claim_month,
       SUM(paid_amount) AS total_paid_claims
FROM claims
GROUP BY DATE_TRUNC('month', claim_date)::date
ORDER BY claim_month;
 claim_month | total_paid_claims 
-------------+-------------------
 2024-03-01  |              0.00
 2024-04-01  |         360000.00
 2024-05-01  |        4800000.00
 2024-06-01  |         650000.00
 2024-07-01  |        7800000.00
 2024-08-01  |        6000000.00
(6 rows)


===== Q21 =====
-- Q21 [metric] Top products by earned premium proxy.

-- Q21 [metric] Top products by earned premium proxy.
SELECT pr.product_code, pr.product_name, SUM(p.annual_premium) AS total_annual_premium
FROM policies p
INNER JOIN insurance_products pr ON pr.product_id = p.product_id
GROUP BY pr.product_code, pr.product_name
ORDER BY total_annual_premium DESC
LIMIT 5;
  product_code  |        product_name        | total_annual_premium 
----------------+----------------------------+----------------------
 PENSION-RET-01 | Retirement Pension Builder |           1260000.00
 HEALTH-PREM-01 | Health Premium Care        |            845000.00
 AUTO-PLUS-01   | Auto Plus Cover            |            655000.00
 TERM-LIFE-02   | Term Life Secure 20        |            640000.00
 HEALTH-STD-01  | Health Standard Care       |            545000.00
(5 rows)


===== Q22 =====
-- Q22 [metric] Customers with the highest paid-claim-to-premium ratio.

-- Q22 [metric] Customers with the highest paid-claim-to-premium ratio.
SELECT c.customer_code,
       c.full_name,
       SUM(cl.paid_amount) AS total_paid_claims,
       SUM(p.annual_premium) AS total_annual_premium,
       ROUND(SUM(cl.paid_amount) / NULLIF(SUM(p.annual_premium), 0), 4) AS paid_claim_to_premium_ratio
FROM customers c
INNER JOIN policies p ON p.customer_id = c.customer_id
INNER JOIN claims cl ON cl.policy_id = p.policy_id
GROUP BY c.customer_code, c.full_name
ORDER BY paid_claim_to_premium_ratio DESC
LIMIT 5;
 customer_code | full_name | total_paid_claims | total_annual_premium | paid_claim_to_premium_ratio 
---------------+-----------+-------------------+----------------------+-----------------------------
 CUS-0008      | Han Doyun |        7800000.00 |            275000.00 |                     28.3636
 CUS-0009      | Seo Ara   |        6000000.00 |            320000.00 |                     18.7500
 CUS-0003      | Park Jiho |        1800000.00 |            412000.00 |                      4.3689
 CUS-0004      | Choi Hana |        3000000.00 |            845000.00 |                      3.5503
 CUS-0006      | Kang Yuna |         650000.00 |            185000.00 |                      3.5135
(5 rows)


